versionUri	date	author_ar	author_lat	book	title_ar	title_lat	ed_info	id	status	tok_length	url	tags	author_from_uri	author_lat_shuhra	author_lat_full_name	char_length
0179MalikIbnAnas.Muwatta.JK000466-ara1	0179	مالك بن أنس أبو عبدالله الأصبحي :: مالك	Malik Ibn Anas	0179MalikIbnAnas.Muwatta	موطأ الإمام مالك :: موطأ مالك	Muwatta	محمد فؤاد عبد الباقي :: مصر :: - :: دار إحياء التراث العربي	JK000466	sec	148535	https://raw.githubusercontent.com/OpenITI/0200AH/master/data/0179MalikIbnAnas/0179MalikIbnAnas.Muwatta/0179MalikIbnAnas.Muwatta.JK000466-ara1	CENT0200 :: _FIQH :: _HADITH :: _MALIKI :: _TARAJIM :: GAL@period-classical :: GAL@literature-islamic :: GAL@0750-1000CE :: GAL@malikis :: GAL@literature-arabic :: GAL@fiqh :: JK@الفقه المالكي :: JK@المصنفات والآثار :: JK@كتب الحديث النبوي الشريف وتراجم الرواة :: JK@كتب المصنفات والآثار :: born@JaziratArab_RE :: born@MADINA_396E244N_S	Malik Ibn Anas			556682
0179MalikIbnAnas.Muwatta.ShamAY0033921-ara1	0179	الإمام مالك بن أنس (179 ه) :: مالك بن أنس :: مالك بن أنس بن مالك بن عامر الأصبحي المدني	Malik Ibn Anas	0179MalikIbnAnas.Muwatta	الموطأ برواية ابن القاسم - ت المالكي :: موطأ الإمام مالك بن أنس رواية ابن القاسم  :: موطأ الإمام مالك بن أنس رواية ابن القاسم	Muwatta	السيد محمد بن علوي بن عباس المالكي :: الأولى 1425 ه - 2004 م :: منشورات المجمع الثقافي، أبو ظبي - الإمارات	ShamAY0033921	sec	33201	https://raw.githubusercontent.com/OpenITI/0200AH/master/data/0179MalikIbnAnas/0179MalikIbnAnas.Muwatta/0179MalikIbnAnas.Muwatta.ShamAY0033921-ara1	 :: ShamAY@متون الحديث :: born@JaziratArab_RE :: born@MADINA_396E244N_S	Malik Ibn Anas			126662
0179MalikIbnAnas.Muwatta.Shia000901Vols-ara1	0179	الإمام مالك	Malik Ibn Anas	0179MalikIbnAnas.Muwatta	كتاب الموطأ	Muwatta	تصحيح وتعليق : محمد فؤاد عبد الباقي :: 1406 - 1985 م	Shia000901Vols	sec	213510	https://raw.githubusercontent.com/OpenITI/0200AH/master/data/0179MalikIbnAnas/0179MalikIbnAnas.Muwatta/0179MalikIbnAnas.Muwatta.Shia000901Vols-ara1	CENT0200 :: _FIQH :: _HADITH :: _MALIKI :: _TARAJIM :: GAL@period-classical :: GAL@literature-islamic :: GAL@0750-1000CE :: GAL@malikis :: GAL@literature-arabic :: GAL@fiqh :: Shia@فقه المذهب المالكي :: born@JaziratArab_RE :: born@MADINA_396E244N_S	Malik Ibn Anas			837418
0463IbnCabdBarr.IstidhkarJamic.JK001503-ara1	0463	ابن عبد البر ::  أبو عمر يوسف بن عبد الله بن محمد بن عبد البر القرطبي النمري	Ibn Cabd Barr :: Ibn ʿAbd al-Barr ::  Abū ʿUmar Yūsuf b. ʿAbd Allāh b. Muḥammad b. ʿAbd al-Barr al-Qurṭubī al-Namarī	0463IbnCabdBarr.IstidhkarJamic	الاستذكار :: الاستذكار الجامع لمذاهب فقهاء الأمصار	Istidhkar Jamic	سالم محمد عطا-محمد علي معوض :: بيروت :: 2000م :: دار الكتب العلمية	JK001503	sec	1131885	https://raw.githubusercontent.com/OpenITI/0475AH/master/data/0463IbnCabdBarr/0463IbnCabdBarr.IstidhkarJamic/0463IbnCabdBarr.IstidhkarJamic.JK001503-ara1	CENT0500 :: _FIQH :: _HADITH :: _MALIKI :: _SHARH :: _SUNNI :: GAL@literature-islamic :: GAL@1000-1258CE :: GAL@hadith :: GAL@literature-arabic :: GAL@period-postclassical :: GAL@spain :: JK@الفقه المالكي :: JK@كتب الفقه الإسلامي :: JK@كتب المصنفات والآثار :: born@QURTUBA_047W379N_S :: born@Andalus_RE :: died@SHATIBA_005W389N_S :: resided@QURTUBA_047W379N_S :: resided@DANIYA_001E388N_S :: resided@LISHBUNA_091W387N_S :: resided@SHANTARIN_087W392N_S :: resided@BALANSIYYA_004W394N_S :: resided@SHATIBA_005W389N_S :: visited@ISHBILIYYA_059W374N_S :: visited@BATALYUS_069W388N_S	Ibn Cabd Barr	Ibn ʿAbd al-Barr	 Abū ʿUmar Yūsuf b. ʿAbd Allāh b. Muḥammad b. ʿAbd al-Barr al-Qurṭubī al-Namarī	4421906
0463IbnCabdBarr.IstidhkarJamic.ShamAY0033530-ara1	0463	ابن عبد البر ::  أبو عمر يوسف بن عبد الله بن محمد بن عبد البر القرطبي النمري	Ibn Cabd Barr :: Ibn ʿAbd al-Barr ::  Abū ʿUmar Yūsuf b. ʿAbd Allāh b. Muḥammad b. ʿAbd al-Barr al-Qurṭubī al-Namarī	0463IbnCabdBarr.IstidhkarJamic	الاستذكار الجامع لمذاهب فقهاء الأمصار - ت: قلعجي :: الاستذكار الجامع لمذاهب فقهاء الأمصار وعلماء الأقطار فيما تضمنه الموطأ من معاني الرأي والآثار وشرح ذلك كله بالإيجاز والإختصار. :: الاستذكار الجامع لمذاهب فقهاء الأمصار وعلماء الأقطار فيما تضمنه الموطأ من معاني الرأي والآثار وشرح ذلك كله بالإيجاز والإختصار. 	Istidhkar Jamic	عبد المعطي أمين قلعجي. :: الأولى 1414ه - 1993م :: دار قتيبة - دمشق | دار الوعي - حلب	ShamAY0033530	sec	1130393	https://raw.githubusercontent.com/OpenITI/0475AH/master/data/0463IbnCabdBarr/0463IbnCabdBarr.IstidhkarJamic/0463IbnCabdBarr.IstidhkarJamic.ShamAY0033530-ara1	 :: ShamAY@شروح الحديث :: born@QURTUBA_047W379N_S :: born@Andalus_RE :: died@SHATIBA_005W389N_S :: resided@QURTUBA_047W379N_S :: resided@DANIYA_001E388N_S :: resided@LISHBUNA_091W387N_S :: resided@SHANTARIN_087W392N_S :: resided@BALANSIYYA_004W394N_S :: resided@SHATIBA_005W389N_S :: visited@ISHBILIYYA_059W374N_S :: visited@BATALYUS_069W388N_S	Ibn Cabd Barr	Ibn ʿAbd al-Barr	 Abū ʿUmar Yūsuf b. ʿAbd Allāh b. Muḥammad b. ʿAbd al-Barr al-Qurṭubī al-Namarī	4431081
0463IbnCabdBarr.Istighna.Sham19Y0132971-ara1	0463	ابن عبد البر ::  أبو عمر يوسف بن عبد الله بن محمد بن عبد البر القرطبي النمري	Ibn Cabd Barr :: Ibn ʿAbd al-Barr ::  Abū ʿUmar Yūsuf b. ʿAbd Allāh b. Muḥammad b. ʿAbd al-Barr al-Qurṭubī al-Namarī	0463IbnCabdBarr.Istighna	الاستغناء في معرفة المشهورين من حملة العلم بالكنى «وهو مشتمل على ثلاثة كتب في الكنى» :: الاستغناء في معرفة المشهورين من حملة العلم بالكنى	Istighna	الأولى، 1405 ه - 1985 م :: دار ابن تيمية للنشر والتوزيع والإعلام، الرياض - المملكة العربية السعودية	Sham19Y0132971	pri	313290	https://raw.githubusercontent.com/OpenITI/0475AH/master/data/0463IbnCabdBarr/0463IbnCabdBarr.Istighna/0463IbnCabdBarr.Istighna.Sham19Y0132971-ara1	 :: Sham@التراجم والطبقات :: born@QURTUBA_047W379N_S :: born@Andalus_RE :: died@SHATIBA_005W389N_S :: resided@QURTUBA_047W379N_S :: resided@DANIYA_001E388N_S :: resided@LISHBUNA_091W387N_S :: resided@SHANTARIN_087W392N_S :: resided@BALANSIYYA_004W394N_S :: resided@SHATIBA_005W389N_S :: visited@ISHBILIYYA_059W374N_S :: visited@BATALYUS_069W388N_S	Ibn Cabd Barr	Ibn ʿAbd al-Barr	 Abū ʿUmar Yūsuf b. ʿAbd Allāh b. Muḥammad b. ʿAbd al-Barr al-Qurṭubī al-Namarī	1262179
